티커,종목명,섹터,산업,현재가,수익률(%)
MNKD,MannKind Corporation Common Stock,Health Care,Biotechnology: Pharmaceutical Preparations,3.15,15.15
DIN,Dine Brands Global Inc. Common Stock,Consumer Discretionary,Restaurants,30.6,15.12
IMPP,Imperial Petroleum Inc. Common Shares,Consumer Discretionary,Marine Transportation,4.91,15.11
AAPL,Apple Inc. Common Stock,Technology,Computer Manufacturing,297.63,15.1
NEON,Neonode Inc. Common Stock,Technology,Industrial Machinery/Components,1.74,15.09
SNX,TD SYNNEX Corporation Common Stock,Technology,Retail: Computer Software & Peripheral Equipment,234.99,15.06
SMTI,Sanara MedTech Inc. Common Stock,Health Care,Industrial Specialties,21.3,15.05
PROF,Profound Medical Corp. Common Stock,Health Care,Medical/Dental Instruments,7.2,15.02
ARRY,Array Technologies Inc. Common Stock,Consumer Discretionary,Miscellaneous manufacturing industries,8.61,15.02
